CATEGORY; SUMMARY; NUMBER_OF_VULNERABILITIES; NUMBER_OF_VULNERAILITIES_WITH_CRITICALITY_FOR_HEALTH; AVERAGE_SCORE; PRESENCE; IMPACT 
CWE-22;Improper Limitation of a Pathname to a Restricted Directory ('Path Traversal'). The software uses external input to construct a pathname that is intended to identify a file or directory that is located underneath a restricted parent directory, but the software does not properly neutralize special elements within the pathname that can cause the pathname to resolve to a location that is outside of the restricted directory.;1;0;5,0;,11110;,55550;
CWE-89;"Improper Neutralization of Special Elements used in an SQL Command ('SQL Injection'). The software constructs all or part of an SQL command using externally-influenced input from an upstream component, but it does not neutralize or incorrectly neutralizes special elements that could modify the intended SQL command when it is sent to a downstream component. Without sufficient removal or quoting of SQL syntax in user-controllable inputs, the generated SQL query can cause those inputs to be interpreted as SQL instead of ordinary user data. This can be used to alter query logic to bypass security checks, or to insert additional statements that modify the back-end database, possibly including execution of system commands. SQL injection has become a common issue with database-driven web sites. The flaw is easily detected, and easily exploited, and as such, any site or software package with even a minimal user base is likely to be subject to an attempted attack of this kind. This flaw depends on the fact that SQL makes no real distinction between the control and data planes.";1;1;7,5;,11110;,83330;
CWE-20;Improper Input Validation. The product does not validate or incorrectly validates input that can affect the control flow or data flow of a program. When software does not validate input properly, an attacker is able to craft the input in a form that is not expected by the rest of the application. This will lead to parts of the system receiving unintended input, which may result in altered control flow, arbitrary control of a resource, or arbitrary code execution.;1;1;9,3;,11110;1,03320;
NVD-CWE-noinfo;Category with no information;5;1;5,18;,55560;2,87800;
CWE-311;Missing Encryption of Sensitive Data;1;1;2,1;,11110;,23330;


TOTAL VULNERABILITIES; 9